{
  "schema_version": "1.0.0",
  "payload_type": "vertical_narrative",
  "vertical_id": "real_estate",
  "display_name": "Real Estate",
  "status_quo": "A 10%+ overstatement in collection rate masks $200K+ in uncollected rent, directly impacting LP distributions and investor confidence.",
  "with_bayesiq": "BayesIQ's audit surfaced 4 findings and enabled targeted remediation that improved the reliability score from 43 to 65.",
  "headline_finding": "Reported vacancy_loss for 2025-12 is 5.1%, but recomputed value from raw events is 0.0%. Discrepancy of +100.0%.",
  "cta_label": "Book a Real Estate Data Diagnostic",
  "cta_variant": "diagnostic"
}
